text,author,date,rating,location,source
"The new moisturizer is amazing! My skin feels so hydrated after just one week.",skincare_lover,2025-12-01,5,Seoul,google_reviews
"Decent product but a bit overpriced for what you get.",honest_reviewer,2025-12-02,3,Busan,naver
"Best serum I've ever used. The niacinamide really works for my dark spots.",glow_queen,2025-12-03,5,Incheon,instagram
"Broke me out after 3 days. Not suitable for sensitive skin.",unhappy_user,2025-12-04,1,Daegu,olive_young
"Love the packaging and the scent. Will definitely repurchase!",beauty_fan,2025-12-05,4,Seoul,coupang
